{
    "$schema": "http://json-schema.org/draft-07/schema#",
    "type": "object",
    "properties": {
        "pattern": {
            "type": "string",
            "description": "The error pattern to match"
        },
        "fix": {
            "type": "string",
            "description": "The command or script to fix the error"
        },
        "success_rate": {
            "type": "number",
            "minimum": 0,
            "maximum": 1,
            "description": "Success rate of this fix"
        },
        "context": {
            "type": "object",
            "properties": {
                "type": {
                    "type": "string",
                    "enum": ["dependency", "syntax", "lint", "build"]
                },
                "language": {
                    "type": "string"
                },
                "tool": {
                    "type": "string"
                }
            }
        },
        "history": {
            "type": "array",
            "items": {
                "type": "object",
                "properties": {
                    "date": {
                        "type": "string",
                        "format": "date-time"
                    },
                    "success": {
                        "type": "boolean"
                    }
                }
            }
        }
    },
    "required": ["pattern", "fix"]
}