{
    "pattern": "'registerBlockVariation' is not defined",
    "fix": "sed -i '' '1i\\import { registerBlockVariation, registerBlockPattern } from \"@wordpress/blocks\";' \"$FILE\"",
    "success_rate": 0.90,
    "context": {
        "type": "syntax",
        "language": "javascript",
        "tool": "eslint"
    }
} 